{
  "command": "spectralbio replay --target crebbp",
  "status": "PASS",
  "exit_code": 0,
  "mode": "replay",
  "target": "CREBBP",
  "surface_role": "replay_ready_transfer_surface",
  "started_at": "2026-04-22T19:49:54.532099+00:00",
  "finished_at": "2026-04-22T19:49:54.655279+00:00",
  "duration_seconds": 0.123201,
  "offline": true,
  "cpu_only": true,
  "artifacts_used": [
    "benchmarks/crebbp/benchmark_table.tsv",
    "benchmarks/crebbp/score_reference.tsv",
    "benchmarks/crebbp/sequence_reference.fasta"
  ],
  "artifacts_emitted": [
    "outputs/replay/crebbp/checksums.json",
    "outputs/replay/crebbp/manifest.json",
    "outputs/replay/crebbp/metrics.json",
    "outputs/replay/crebbp/provenance.json",
    "outputs/replay/crebbp/status.json",
    "outputs/replay/crebbp/summary.json",
    "outputs/replay/crebbp/verification.json"
  ],
  "checks_performed": [
    "schema_validation",
    "checksum_validation",
    "target_verification"
  ],
  "metrics": {
    "replay_ready": true,
    "transfer_positive": true,
    "near_transfer_positive": true,
    "n_variants": 298,
    "n_positive": 116,
    "n_negative": 182,
    "positive_witness_models": [
      "ProtT5"
    ],
    "positive_witness_variants": [
      "CREBBP:R1340P"
    ]
  },
  "warnings": [],
  "next_action": "none",
  "details": {}
}
